{
  "schema_version": 1,
  "revision": "5",
  "marketplace": {
    "id": "openscience",
    "name": "OpenScience Specialist Marketplace"
  },
  "specialists": [
    {
      "id": "aerodynamics-cfd-validator",
      "display_name": "Aerodynamics CFD Verification and Validation Specialist",
      "summary": "Designs evidence-bound aerodynamic CFD verification and validation workflows, including mesh convergence, numerical uncertainty, turbulence-model sensitivity, and comparison with experiments without inventing aerodynamic results.",
      "publisher": {
        "id": "aipoch",
        "name": "Aipoch",
        "url": "https://github.com/aipoch"
      },
      "latest": {
        "version": "1.0.0",
        "release": {
          "path": "releases/aerodynamics-cfd-validator/1.0.0.json",
          "sha256": "b350ce105bfb581e6432af7c9bb5c0c832270cb24b7192077125d46f38eef0d1"
        }
      }
    },
    {
      "id": "astronomical-photometry-analyzer",
      "display_name": "Astronomical Photometry and Time-domain Analysis Specialist",
      "summary": "Designs calibrated astronomical image, photometry, transient, and variability analysis workflows with explicit detector characterization, false-alarm control, uncertainty propagation, and no fabricated magnitudes or classifications.",
      "publisher": {
        "id": "aipoch",
        "name": "Aipoch",
        "url": "https://github.com/aipoch"
      },
      "latest": {
        "version": "1.0.0",
        "release": {
          "path": "releases/astronomical-photometry-analyzer/1.0.0.json",
          "sha256": "5415b7ab15262fa296678a0300612747f7d779a023556410275b31dc15968dbf"
        }
      }
    },
    {
      "id": "atmospheric-chemistry-modeler",
      "display_name": "Atmospheric Chemistry Transport Modeling Specialist",
      "summary": "Designs reproducible meteorology-chemistry transport, emissions, source-attribution, and nonlinear control-sensitivity studies for air pollution episodes without inventing model performance or policy effects.",
      "publisher": {
        "id": "aipoch",
        "name": "Aipoch",
        "url": "https://github.com/aipoch"
      },
      "latest": {
        "version": "1.0.0",
        "release": {
          "path": "releases/atmospheric-chemistry-modeler/1.0.0.json",
          "sha256": "9c13a4b68ed38439b3e6cc499502222a1575e2e55374272a0a01498a8ef3b11b"
        }
      }
    },
    {
      "id": "auto-research-specialist",
      "display_name": "Auto Research Specialist",
      "summary": "Coordinates reproducible biomedical research from evidence discovery through analysis, validation, and writing.",
      "publisher": {
        "id": "aipoch",
        "name": "Aipoch",
        "url": "https://github.com/aipoch"
      },
      "latest": {
        "version": "1.0.1",
        "release": {
          "path": "releases/auto-research-specialist/1.0.1.json",
          "sha256": "ada8a6c4cab6685a2a400f497c35507bac7508baa79dc36ccaf8e63283d8f54b"
        }
      }
    }
  ]
}
